CONTENTID,CONTENTTYPEID,CAT1,CAT2,CAT3,TITLE,SIDOCODE,SIGUNGUCODE,ADDRESS,CREATEDTIME,MODIFIEDTIME,MAPX,MAPY,MLEVEL,FIRSTIMAGE,MCATEGORY,SCATEGORY,SEARCHCOUNT,OVERVIEW
2873184,39,A05,A0502,A05020100,가야밀냉면해물칼국수,1,1022,서울특별시 은평구 대서문길 36 북한산성상가 A동 106호,20221024141353,20221024141407,126.948537895,37.6555794652,6.0,http://tong.visitkorea.or.kr/cms/resource/72/2873172_image2_1.jpg,음식,한식,8014,"가야밀냉면해물칼국수는 은평구 효자동 행정복지센터 부근 북한산 초입 상가에 있다. 상가 주차장과 공영주차장이 있어 방문 시 자동차를 이용하기 편리하다. 이곳은 37년 전통의 밀면 전문점으로 유명하다. TV 맛집 프로그램에 소개된 집으로 등산객들에게 오랜 사랑을 받아온 음식점이다. 매장 안은 넓고 테이블이 많다. 대표 메뉴는 물밀면, 비빔밀면, 콩밀면, 칼국수, 만두가 있다. 추가로 해물파전, 부추전, 감자전, 메밀전병이 인가가 많다. 주변에 북한산성이 있어 연계 관광에 좋다."
2853937,39,A05,A0502,A05020100,마복림할머니막내아들네,1,1024,서울특별시 중구 다산로 221 ,20220915135629,20220915135641,127.0151038977,37.5629747614,6.0,http://tong.visitkorea.or.kr/cms/resource/32/2853932_image2_1.jpg,음식,간이음식,7999,"신당역 7번 출구에서 도보 5분 이내 거리에 있는 떡볶이 전문점이다. 신당동 떡볶이 골목에 있다. 대표메뉴는 즉석떡볶이이고, 그 외에도 떡볶이, 오뎅, 순대, 닭발 등 다양한 메뉴가 있다. 24시간 영업이지만 매장 식사는 새벽 5시부터 오후 9시까지만 가능하다. 포장과 배달이 가능하다. 매장 앞에는 주차장이 없지만, 직원이 직접 발렛파킹을 해주기 때문에 차를 가지고 방문하기에 좋다. 매장 분위기가 예스럽고 정겨우며, 내부가 넓고 2층까지 있어서 여유 있게 식사를 즐길 수 있다. 근처에 서울중앙시장, 충무아트센터, 신당지하상가 등이 있어서 관광하기 좋다."
2834768,39,A05,A0502,A05020100,응순가재골수제비,1,1009,서울특별시 노원구 동일로242길 100 ,20220809151212,20220809151451,127.0606632374,37.6744820621,6.0,http://tong.visitkorea.or.kr/cms/resource/59/2834759_image2_1.jpg,음식,한식,7992,"응순가재골수제비 맛집은 7호선 수락산역 3번 출구 노원초등학교 인근에 있다. 얼큰하게 끓여 내는 수제비가 주메뉴다. 모 방송사 프로그램에 달인으로 선정될 만큼 수락산 자락을 대표하는 맛집이다. 두 번째로 인기가 많은 메뉴는 매콤 오징어 부추전으로, 등산객은 물론 동네 주민들로부터 사랑받고 있다. 주변에 벽운계곡이 있어 연계 관광이 가능하다."
1985351,39,A05,A0502,A05020100,문배동육칼,1,1021,서울특별시 용산구 백범로90길 50 ,20150122191043,20230613140017,126.970328168,37.5365964678,6.0,http://tong.visitkorea.or.kr/cms/resource/37/1984537_image2_1.jpg,음식,한식,7953,"문배동 육칼은 육개장 칼국수의 줄임말로 육개장과 칼국수를 함께 제공하는 음식점이다. 육개장과 칼국수(대)를 맛보거나 육개장과 칼국수(소)에 공깃밥을 맛볼 수 있다. 육개장은 포장 판매도 하며, 반찬 추가는 셀프이고, 육수는 리필이 가능하다."
2902652,39,A05,A0502,A05020100,혜화칼국수,1,1023,서울특별시 종로구 창경궁로35길 13 ,20221109102004,20221109102019,127.0015155765,37.586618992,6.0,http://tong.visitkorea.or.kr/cms/resource/46/2902646_image2_1.jpg,음식,한식,7946,"혜화칼국수는 서울특별시 종로구 혜화동에 있는 칼국수 맛집이다. 대중교통을 이용한다면 지하철 4호선 혜화역 4번 출구 부근에 있다. 혜화동의 오래된 노포로 1층과 1층에 좌식 테이블이 있다. 유명한 TV 프로그램에 소개되면서 더욱 그 맛을 인정받은 곳이다. 대표 메뉴는 국시, 수육, 생선튀김이고 수육, 바싹 불고기, 녹두빈대떡도 인기다. 주변에 창덕궁(세계문화유산), 종묘(세계문화유산), 하늘한마당이 있다 연계 관광에 좋다."
2836111,39,A05,A0502,A05020100,산들애건강밥상,1,1022,서울특별시 은평구 대서문길 43-16 ,20220811165203,20220811165214,126.9492544791,37.6561877405,6.0,http://tong.visitkorea.or.kr/cms/resource/06/2836106_image2_1.jpg,음식,한식,7924,"산들애건강밥상은 서울 은평구 진관동 북한산초등학교 인근에 있다. 이곳은 건강한 저염식 밥상 만들기를 통해 짠맛을 줄인 순한 식당으로 지정되었으며, 한국음식관광협회 제14대 대한민국 조리명인으로 선정되었다. 이 식당의 대표 메뉴인 코다리 구이는 콩나물과 양파볶음이 함께 나온다. 밑반찬은 샐러드 외 6가지가 나온다. 그 외 메뉴는 주꾸미볶음, 제육볶음, 감자전, 도토리묵이 있다. 북한산 등산 후 찾는 이가 많다. 붐비는 시간 대기자를 위해 2층에 따로 휴게 공간이 마련되어 있다. 식당의 인근에는 북한산과 은평한옥마을이 있어 연계 관광이 가능하다."
2870538,39,A05,A0502,A05020100,신동궁감자탕역삼본점,1,1001,서울특별시 강남구 테헤란로10길 21 ,20221019144528,20221019144611,127.0328319056,37.4978465342,6.0,http://tong.visitkorea.or.kr/cms/resource/23/2870523_image2_1.jpg,음식,한식,7922,"신동궁감자탕 역삼본점은 감자탕과 뼈숯불구이 맛집이다. 지하철 2호선 역삼역 3번 출구와 가깝다. 역삼 본점, 명동, 선릉, 청주점 등에도 매장을 갖고 있는 신동궁감자탕의 대표 메뉴는 감자탕과 뼈숯불구이, 뼈찜, 뼈해장국, 낙지뚝배기, 묵은지 김치찜, 뚝배기불고기 등이다. 뼈 숯불구이는 작은 것을 시켜도 푸짐하다. 뼈 숯불구이는 TV 맛집 프로그램에 여러 차례 소개되었다. 매장 인근에 역삼개나리공원, 역삼까치공원, 역삼공원이 있어 식사 후 가벼운 산책이 가능하다."
2763742,39,A05,A0502,A05020300,미우야,1,1015,서울특별시 서초구 강남대로23길 90 (양재동),20211027230245,20221202115025,127.0353962329,37.474088227,6.0,,음식,전문음식,7832,"서울 서초구 양재천 카페거리, 메타세쿼이아 거리에 있는 일본식 우동 소바 전문점이다. 건물 앞에 언제나 긴 줄로 식사를 기다리는 사람들을 볼 수 있다. 시금치와 계란이 올라간 베이컨 소바와 생크림과 명란으로 만든 우동 등, 특이한 면과 초밥 종류를 맛볼 수 있다. 식사 후에는 양재 시민의 숲과 양재천 공원을 걸을 수 있다. 지하철 신분당선 양재시민의숲역 1번 출구에서 여의천을 따라가다 양재천 숲길과 만나는 곳에 있다."
2836182,39,A05,A0502,A05020100,용마해장국,1,1025,서울특별시 중랑구 용마공원로5길 8 ,20220812094354,20220812094404,127.1015479043,37.594500433,6.0,http://tong.visitkorea.or.kr/cms/resource/79/2836179_image2_1.jpg,음식,한식,7754,"용마해장국집은 서울 중랑구 망우동 용마공원 면북초등학교 인근에 있다. 망우동 주택가 붉은색 2층 건물에 있다. 주차는 어렵고 인근 유료 주차장을 이용해야 한다. 24년 전통의 해장국만 파는 집으로, 여러 방송에 소개되었고 연예인도 다녀간 맛집이다. 단일 품목인 해장국에는 소 목뼈, 선지, 우거지, 콩나물이 들어간다. 고추장아찌는 이 집만의 노하우로 손수 만든 반찬이다. 해장국 포장도 가능하며, 고추장아찌는 별도 주문 메뉴이기도 하다. 식당 인근에는 캠핑장, 골프장, 공원 등 관광지가 있어 연계 관광이 가능하다."
2849708,39,A05,A0502,A05020100,마부자생삼겹살,1,1004,서울특별시 강서구 마곡중앙5로 6 마곡나루역보타닉푸르지오시티 1층 121호,20220906125633,20220906125650,126.826970926,37.5673431093,6.0,http://tong.visitkorea.or.kr/cms/resource/04/2849704_image2_1.jpg,음식,한식,7751,"마부자생삼겹살은 지하철 9호선, 공항선 마곡나루역 1번 출구 바로 앞에 있다. 매장 상가건물에 자체 주차장이 있어 방문 시 자동차로 이용하기 좋다. 전철역이 가까워 대중교통 이용도 편리하다. 이곳은 늘 만석이라 웨이팅을 생각하고 방문해야 한다. 마부자삼겹살은 두툼한 국내산 생삼겹과 김치를 함께 올려 굽는 맛집으로 유명하다. 마지막 코스로 볶음밥으로 마무리하는 조합이 인기가 많다. 대표 메뉴로 생삼겹살, 목살, 물냉면, 볶음밥이 있다. 추가로 김치찌개와 계란말이가 많이 나간다. 주변에 돌고랑 문화공원과 서울식물원습지원, 강서한강공원이 있어 식사 전후에 둘러보기 좋다."
2754725,39,A05,A0502,A05020100,애란궁,1,1001,서울특별시 강남구 광평로 220-12 (수서동),20211007234058,20231026151523,127.0978485787,37.4848964284,6.0,,음식,전문음식,7686,"오리 요리와 한정식을 전문으로 하는 식당으로, 직접 텃밭에서 재배한 야채와 장과 장아찌를 제공한다. 건강한 식사를 원하는 사람들에게 인기 있는 식당으로 예약을 하지 않으면 대기할 수 있다. 주택을 개조한 인테리어로 계절이 좋을 때는 야외 테라스에서 차를 마실 수 있고, 수백 개의 난 구경과 더불어 넓은 정원을 여유롭게 산책할 수 있다."
2870779,39,A05,A0502,A05020100,한티옥,1,1001,서울특별시 강남구 도곡로 418 강원빌딩 ,20221019162733,20221020164613,127.0562631303,37.4970109405,6.0,http://tong.visitkorea.or.kr/cms/resource/60/2870760_image2_1.jpg,음식,한식,7555,"한티옥은 수인분당선 한티역 3번 출구 단국사대부속고등학교 인근에 있다. 이곳은 안동국시를 대표 메뉴로 향토 음식을 파는 가게다. 건물 앞에 주차장이 있고 발레파킹 서비스를 받을 수 있다. 내부는 4인에서 8인 테이블로 간격이 넓고 테이블마다 공간 구분 파티션이 설치되어 있다. 식사 메뉴는 안동국시, 안동국밥, 양지국밥, 곤드레비빔밥, 만두국, 통국수, 보쌈정식, 밀사랑정식이 있다. 별식으로 손만두, 녹두전, 동태전, 홍어무침, 수육이 있다. 방송사 맛집 프로그램에 소개된 음식점이다. 인근에 한티근린공원, 논현까치공원이 있어 식사 후 가벼운 산책이 가능하다."
2840078,39,A05,A0502,A05020100,장털보설렁탕본점,1,1018,서울특별시 송파구 중대로 288 ,20220819161859,20220916133121,127.1324753803,37.506191803,6.0,http://tong.visitkorea.or.kr/cms/resource/70/2840070_image2_1.jpg,음식,한식,7502,"장털보설렁탕은 서울특별시 송파구 오금동에 있다. 대중교통을 이용한다면 3호선과 5호선 오금역 2번 출구와 가깝다. 가게 입구에 커다란 가마솥을 걸어놓고 하루 종일 뽀얀 국물을 우리는 모습이 인상적이다. 주방도 오픈형이라 믿음이 간다. 테이블 마다 배추김치와 무김치가 담긴 작은 단지가 있어 김치는 원하는 만큼 직접 덜어 먹을 수 있고 입식과 좌식 테이블이 섞여 있어 취향대로 원하는 자리에 앉을 수 있다. 새벽 5시부터 영업을 시작해 아침 식사할 수 있는 곳으로 대표 메뉴는 설렁탕, 해장국, 털보탕이고 도가니탕, 꼬리곰탕, 수육도 주문이 많다. 식당 인근에 오금공원, 백토공원 성내천 물빛광장이 있어 식사 후 가볍게 산책하기 좋다."
2849386,39,A05,A0502,A05020100,나리의집,1,1021,서울특별시 용산구 이태원로 245 ,20220906102438,20220906102452,127.0002559896,37.5368775275,6.0,http://tong.visitkorea.or.kr/cms/resource/64/2849364_image2_1.jpg,음식,한식,7463,"나리의집 식당은 6호선 한강진역 1번 출구 인근에 있다. 주차는 가게 앞 주차할 수 있으나 협소하여 대중교통을 이용하는 것이 좋다. 식당의 간판에서 노포의 느낌이 먼저 든다. 기본 웨이팅이 있어 종이 번호표를 받고 기다려야 한다. 대표 메뉴는 냉동 삼겹살과 청국장인데 냉동 삼겹살을 주문하면 기본 반찬 콩나물무침, 오이, 계란말이, 김치, 상추, 파절이 등이 나온다. 주인 할머니가 직접 만든 청국장도 좋다. 이 외 김치섞어찌개도 세트 메뉴로 인기가 있고 순두부, 김치, 당면이 섞여 있어 밥도둑이라 할 만큼 맛있다. 식당 인근에 한남동 카페거리, 삼성미술관, 용산공예관이 있어 연계 관광을 할 수 있다."
2752546,39,A05,A0502,A05020100,돝고기506,1,1001,"서울특별시 강남구 역삼로17길 53 (역삼동)서연빌딩 2,3층",20211001230104,20230921102845,127.0362288061,37.4982826556,6.0,,음식,한식,7423,"506시간 동안 숙성한 삼겹살, 목살, 항정살, 늑간살 등 다양한 부위를 맛볼 수 있는 돼지고기구이 전문 식당이다, 숙성 방법은 27년의 노하우를 가진 우가 R&D팀이 2년간의 연구 개발을 통해 완성했다고 한다. 
역삼역 3번 출구 근처 고급스러운 외관의 대형 건물로 2층은 일반석, 3층은 예약제 프라이빗 룸을 운영하고 있다. 방탄소년단이 방문했고, 이영자가 삼겹살 맛집으로 소개하는 등 연예인에게 인기가 많은 고깃집이다. 방송 밥블레스유 6회, 나혼자산다 224회에 소개되었다."
2774277,39,A05,A0502,A05020900,더리버마리나,1,1015,서울특별시 서초구 동작대로 350 (반포동),20211115183101,20230217154819,126.9811002794,37.5058141254,6.0,http://tong.visitkorea.or.kr/cms/resource/40/2779740_image2_1.jpg,레저스포츠,수상레저스포츠,2705,"더 리버 마리나는 휴양지에 온 것 같은 기분을 선사하는 요트와 커피를 함께 즐길 수 있는 복합문화공간으로 현대요트가 운영하는 서울 한강 반포지점이다. 한강을 조망하며 음료와 디저트를 즐길 수 있으며, 야외 데크에서는 텐트에서 음료와 음식과 함께 캠핑을 즐길 수 있다. 가장 인기 있는 메뉴로는 보트 위에서 커피를 즐길 수 있는 커피 보팅(주간 30분)으로 보트는 화~일요일 14:00~18:00 정시에 출항한다. 커피와 함께 무지개 분수를 볼 수 있는 야간 커피 보팅과 요트 안에서 음료와 디저트를 즐길 수 있는 커플 전용 요트 카페도 데이트 코스로 인기 있다. 차량 이용 시 반포한강공원 주차장을 이용하면 되며, 대중교통으로는 지하철 4호선, 9호선 동작역 2번 출구에서 10분 거리에 있다."
